{
  "$schema": "https://json-schema.org/draft/2020-12/schema",
  "title": "Vapor game manifest",
  "type": "object",
  "required": ["schema", "slug", "title", "authors", "source", "license", "assets_policy", "artifact", "saves", "contact"],
  "additionalProperties": false,
  "properties": {
    "schema": { "const": 1 },
    "slug": { "type": "string", "pattern": "^[a-z0-9]+(-[a-z0-9]+)*$", "maxLength": 64 },
    "title": { "type": "string", "minLength": 1 },
    "authors": { "type": "array", "minItems": 1, "items": { "type": "string" } },
    "source": {
      "type": "object", "required": ["repo", "commit"], "additionalProperties": false,
      "properties": { "repo": { "type": "string", "format": "uri" }, "commit": { "type": "string" } }
    },
    "license": {
      "type": "object", "required": ["code", "assets"], "additionalProperties": false,
      "properties": { "code": { "type": "string" }, "assets": { "type": "string" } }
    },
    "assets_policy": { "enum": ["open", "bring-your-own"] },
    "artifact": {
      "type": "object", "required": ["url", "sha256", "size", "entry"], "additionalProperties": false,
      "properties": {
        "url": { "type": "string", "pattern": "^https://github\\.com/lucasgmagalhaes/vapor-artifacts/releases/download/" },
        "sha256": { "type": "string", "pattern": "^[0-9a-fA-F]{64}$" },
        "size": { "type": "integer", "minimum": 1 },
        "entry": { "type": "string" }
      }
    },
    "saves": {
      "type": "object", "required": ["paths", "version"], "additionalProperties": false,
      "properties": {
        "paths": { "type": "array", "items": { "type": "string", "pattern": "^/" } },
        "version": { "type": "integer", "minimum": 1 }
      }
    },
    "byo_files": {
      "description": "Files the player supplies (required when assets_policy is bring-your-own). Verified locally, never uploaded.",
      "type": "array",
      "items": {
        "type": "object", "required": ["name", "description", "sha256", "size", "mount"], "additionalProperties": false,
        "properties": {
          "name": { "type": "string", "pattern": "^[A-Za-z0-9_-][A-Za-z0-9._-]*$", "maxLength": 64 },
          "description": { "type": "string", "minLength": 1 },
          "sha256": { "type": "string", "pattern": "^[0-9a-fA-F]{64}$" },
          "size": { "type": "integer", "minimum": 1 },
          "mount": { "type": "string", "pattern": "^/" }
        }
      }
    },
    "variant_of": { "description": "Slug of the game this entry is a deliberate variant of (allows a shared title).", "type": "string", "pattern": "^[a-z0-9]+(-[a-z0-9]+)*$" },
    "tags": { "type": "array", "items": { "type": "string" } },
    "contact": { "type": "string" }
  }
}
